{"changeEventPolicies":[{"eventClass":"https://refspec.org/ns/atlas/v3#OrganizationChangeEvent","originalPredicate":"https://refspec.org/ns/atlas/v3#originalOrganization","resourceClass":"https://refspec.org/ns/atlas/v3#EntityResource","resultingPredicate":"https://refspec.org/ns/atlas/v3#resultingOrganization","semanticRing":"entity"}],"crossRingRelationPolicies":[{"predicates":["https://refspec.org/ns/atlas/v3#referencesLegalIdentity"],"sourceResourceClass":"https://refspec.org/ns/atlas/v3#EntityResource","sourceRing":"entity","targetResourceClass":"https://refspec.org/ns/atlas/v3#LegalIdentityResource","targetRing":"legalIdentity"},{"predicates":["https://refspec.org/ns/atlas/v3#hasIndexedSubject"],"sourceResourceClass":"https://refspec.org/ns/atlas/v3#EntityResource","sourceRing":"entity","targetResourceClass":"https://refspec.org/ns/atlas/v3#SubjectConcept","targetRing":"subject"},{"predicates":["https://refspec.org/ns/atlas/v3#hasIndexedSubject"],"sourceResourceClass":"https://refspec.org/ns/atlas/v3#LegalIdentityResource","sourceRing":"legalIdentity","targetResourceClass":"https://refspec.org/ns/atlas/v3#SubjectConcept","targetRing":"subject"}],"format":"refspec-atlas-registry-resource-profiles/3.1","namespace":"https://refspec.org/ns/atlas/v3#","profileDigest":"sha256:d69a48c6c3de33007aea900d8ae4341c493cdf205bbcc201395c48a0d5409d9c","profiles":[{"applicableEntryClasses":["http://www.w3.org/2008/05/skos-xl#Label","https://refspec.org/ns/atlas/v3#AtlasRelease","https://refspec.org/ns/atlas/v3#AtlasResource","https://refspec.org/ns/atlas/v3#CrossRingRelationAssertion","https://refspec.org/ns/atlas/v3#DerivedRelation","https://refspec.org/ns/atlas/v3#EntityResource","https://refspec.org/ns/atlas/v3#MappingAssertion","https://refspec.org/ns/atlas/v3#NativeRelationAssertion","https://refspec.org/ns/atlas/v3#ProjectedRelation","https://refspec.org/ns/atlas/v3#RelationAssertion","https://refspec.org/ns/atlas/v3#ResourceScheme","https://refspec.org/ns/atlas/v3#SkosMappingAssertion","https://refspec.org/ns/atlas/v3#SourceAssignment","https://refspec.org/ns/atlas/v3#SourceRecord","https://refspec.org/ns/atlas/v3#SubjectConcept","https://refspec.org/ns/atlas/v3#ValueResource"],"applicableSemanticRings":["entity","subject","value"],"descriptorBehavior":"descriptorOnlyUntilExactRelease","profile":"codeScheme","resourceKinds":["classification","codeList"]},{"applicableEntryClasses":["http://www.w3.org/2008/05/skos-xl#Label","https://refspec.org/ns/atlas/v3#AtlasRelease","https://refspec.org/ns/atlas/v3#AtlasResource","https://refspec.org/ns/atlas/v3#CrossRingRelationAssertion","https://refspec.org/ns/atlas/v3#DerivedRelation","https://refspec.org/ns/atlas/v3#EntityResource","https://refspec.org/ns/atlas/v3#MappingAssertion","https://refspec.org/ns/atlas/v3#NativeRelationAssertion","https://refspec.org/ns/atlas/v3#ProjectedRelation","https://refspec.org/ns/atlas/v3#RelationAssertion","https://refspec.org/ns/atlas/v3#ResourceScheme","https://refspec.org/ns/atlas/v3#SkosMappingAssertion","https://refspec.org/ns/atlas/v3#SourceAssignment","https://refspec.org/ns/atlas/v3#SourceRecord","https://refspec.org/ns/atlas/v3#SubjectConcept","https://refspec.org/ns/atlas/v3#ValueResource"],"applicableSemanticRings":["entity","subject","value"],"descriptorBehavior":"descriptorOnlyUntilExactRelease","profile":"conceptScheme","resourceKinds":["historicalVocabulary","mappingReference","sourceAssignedVocabulary","subjectVocabulary"]},{"applicableEntryClasses":["http://www.w3.org/2008/05/skos-xl#Label","https://refspec.org/ns/atlas/v3#AtlasRelease","https://refspec.org/ns/atlas/v3#AtlasResource","https://refspec.org/ns/atlas/v3#CrossRingRelationAssertion","https://refspec.org/ns/atlas/v3#DerivedRelation","https://refspec.org/ns/atlas/v3#EntityResource","https://refspec.org/ns/atlas/v3#Identifier","https://refspec.org/ns/atlas/v3#LegalIdentityResource","https://refspec.org/ns/atlas/v3#MappingAssertion","https://refspec.org/ns/atlas/v3#NativeRelationAssertion","https://refspec.org/ns/atlas/v3#ProjectedRelation","https://refspec.org/ns/atlas/v3#RelationAssertion","https://refspec.org/ns/atlas/v3#ResourceScheme","https://refspec.org/ns/atlas/v3#SourceAssignment","https://refspec.org/ns/atlas/v3#SourceRecord","https://refspec.org/ns/atlas/v3#ValueResource"],"applicableSemanticRings":["entity","legalIdentity","value"],"descriptorBehavior":"descriptorOnlyUntilExactRelease","profile":"identifierScheme","resourceKinds":["identifierAuthority"]},{"applicableEntryClasses":["https://refspec.org/ns/atlas/v3#ResourceScheme"],"applicableSemanticRings":[],"descriptorBehavior":"alwaysDescriptorOnly","profile":"resourceCollection","resourceKinds":["resourceFamily"]},{"applicableEntryClasses":["http://www.w3.org/2008/05/skos-xl#Label","https://refspec.org/ns/atlas/v3#AtlasRelease","https://refspec.org/ns/atlas/v3#AtlasResource","https://refspec.org/ns/atlas/v3#CrossRingRelationAssertion","https://refspec.org/ns/atlas/v3#DerivedRelation","https://refspec.org/ns/atlas/v3#EntityResource","https://refspec.org/ns/atlas/v3#LegalIdentityResource","https://refspec.org/ns/atlas/v3#MappingAssertion","https://refspec.org/ns/atlas/v3#NativeRelationAssertion","https://refspec.org/ns/atlas/v3#ProjectedRelation","https://refspec.org/ns/atlas/v3#RelationAssertion","https://refspec.org/ns/atlas/v3#ResourceScheme","https://refspec.org/ns/atlas/v3#SourceAssignment","https://refspec.org/ns/atlas/v3#SourceRecord","https://refspec.org/ns/atlas/v3#ValueResource"],"applicableSemanticRings":["entity","legalIdentity","value"],"descriptorBehavior":"descriptorOnlyUntilExactRelease","profile":"structureScheme","resourceKinds":["structuralSchema"]}],"relationPolicies":[{"assertionPredicates":{"MappingAssertion":["https://refspec.org/ns/atlas/v3#sameEntityAs"],"NativeRelationAssertion":["https://refspec.org/ns/atlas/v3#parentEntity","https://refspec.org/ns/atlas/v3#relatedEntity"],"SourceAssignment":["https://refspec.org/ns/atlas/v3#assignedEntity"]},"resourceClass":"https://refspec.org/ns/atlas/v3#EntityResource","semanticRing":"entity"},{"assertionPredicates":{"MappingAssertion":["https://refspec.org/ns/atlas/v3#sameLegalIdentityAs"],"NativeRelationAssertion":["https://refspec.org/ns/atlas/v3#relatedLegalIdentity","https://refspec.org/ns/atlas/v3#versionOf"],"SourceAssignment":["https://refspec.org/ns/atlas/v3#assignedLegalIdentity"]},"resourceClass":"https://refspec.org/ns/atlas/v3#LegalIdentityResource","semanticRing":"legalIdentity"},{"assertionPredicates":{"MappingAssertion":["http://www.w3.org/2004/02/skos/core#broadMatch","http://www.w3.org/2004/02/skos/core#closeMatch","http://www.w3.org/2004/02/skos/core#exactMatch","http://www.w3.org/2004/02/skos/core#narrowMatch","http://www.w3.org/2004/02/skos/core#relatedMatch"],"NativeRelationAssertion":["http://www.w3.org/2004/02/skos/core#broader","http://www.w3.org/2004/02/skos/core#narrower","http://www.w3.org/2004/02/skos/core#related","https://refspec.org/ns/atlas/v3#hasSchemeMember","https://refspec.org/ns/atlas/v3#thesaurusRelated","https://refspec.org/ns/atlas/v3#thesaurusUse","https://refspec.org/ns/atlas/v3#thesaurusUsedFor"],"SourceAssignment":["https://refspec.org/ns/atlas/v3#assignedSubject"]},"resourceClass":"https://refspec.org/ns/atlas/v3#SubjectConcept","semanticRing":"subject"},{"assertionPredicates":{"MappingAssertion":["https://refspec.org/ns/atlas/v3#equivalentValue"],"NativeRelationAssertion":["https://refspec.org/ns/atlas/v3#broaderValue","https://refspec.org/ns/atlas/v3#replacementValue"],"SourceAssignment":["https://refspec.org/ns/atlas/v3#assignedValue"]},"resourceClass":"https://refspec.org/ns/atlas/v3#ValueResource","semanticRing":"value"}],"schemaVersion":"3.1"}
